{
  "protocol": 1,
  "sessionId": "5b6f1c2e-8d4a-4f3b-9c1d-2e3f4a5b6c7d",
  "title": "Apply today: Quill and Fernwood (fictional)",
  "items": [
    {
      "taskId": "7c8d9e0f-1a2b-4c3d-8e4f-5a6b7c8d9e0f",
      "jobRevision": 1,
      "url": "https://jobs.example/postings/quill-backend-engineer"
    },
    {
      "taskId": "2e4f6a8b-0c1d-4e3f-9a5b-7c9d1e3f5a7b",
      "jobRevision": 2,
      "url": "https://jobs.example/postings/fernwood-staff-swe"
    }
  ],
  "createdAt": "2026-09-23T09:00:00.000Z"
}
